{
  "protocol": "tmux-observer.bindings.v1",
  "schemaVersion": 1,
  "clock": {
    "bootId": "00000000-0000-4000-8000-000000000000",
    "timeNamespace": "time:10"
  },
  "contextId": "00000000000000000000000000000000",
  "epoch": 1,
  "encodedAt": 20130,
  "hostId": "fixture-local",
  "publisherId": "11111111-1111-4111-8111-111111111111",
  "serverGeneration": "tmux-v1:1700000000:4321:/tmp/tmux-fixture/default",
  "receipt": {
    "state": "unavailable",
    "preparedAt": 20125,
    "associationStartedAt": 20100,
    "ownerExpiresAt": 30100,
    "associationExpiresAt": 30100,
    "expiresAt": 30100,
    "error": {
      "code": "attachment_unverified",
      "message": "no current native profile"
    }
  },
  "rows": [
    {
      "sessionRef": {
        "hostId": "fixture-local",
        "serverGeneration": "tmux-v1:1700000000:4321:/tmp/tmux-fixture/default",
        "sessionId": "$2",
        "createdAt": 1700000001
      },
      "attachedClients": 1,
      "association": {
        "state": "unknown",
        "resolvedAt": null,
        "reason": "ambiguous_match"
      }
    }
  ]
}
